,creat,txt,score
0,2022-07-16 17:18:39+00:00,RT Never believe fully what Media serves you On November   shares of Reliance Industries tumbled to the lowest pric,-0.1027
1,2022-07-16 15:04:59+00:00,Top  EV stocks in India  as per market capitalisation   Reliance Industries Ltd  ,0.2023
2,2022-07-16 15:01:02+00:00,Never believe fully what Media serves you On November   shares of Reliance Industries tumbled to the lowe,0.4019
3,2022-07-16 14:55:41+00:00,Reliance Industries Invests  Crores In Edtech Startup Embibe  Express Computer Embibe onlinelearning,0.0
4,2022-07-16 14:41:12+00:00,Karulkar Pratishthan collaborated with ConnectFor  founded by Mrs Shloka Mehta Ambani Daughter in Law of,0.0
5,2022-07-16 14:27:40+00:00,as European countries scramble to secure gas supplies this scheme grants German industries a huge advantage over,0.765
6,2022-07-16 13:51:53+00:00,RT This has been the case across many industries The SOLE reliance on the HYPER visibility of the Other in senior positions is,0.0
7,2022-07-16 13:35:05+00:00,Swing trading opportunity available in Reliance Industries Watch the video on YouTube,0.4215
8,2022-07-16 13:29:39+00:00,Reliance Industries Puts Rs  Cr In Edtech Startup Embibe  The Entrepreneur Story Embibe onlinelearning,0.0
9,2022-07-16 13:09:47+00:00,RT Express EU fury as VDL hands Germany bn lifeline to CONTINUE buying Putins gas EU COMMISSION President Ursula von d,-0.5719
10,2022-07-16 12:25:40+00:00,Reliance Industries injects INR  Cr in edtech startup Embibe EMBIBE Onlinelearning,0.0
11,2022-07-16 12:24:47+00:00,Sir your view on infosys and reliance industries,0.0
12,2022-07-16 12:14:49+00:00,Express EU fury as VDL hands Germany bn lifeline to CONTINUE buying Putins gas EU COMMISSION President Ursula,-0.5719
13,2022-07-16 10:22:50+00:00,Its a pleasure to welcome Mr B Narayan Group President Reliance Industries Ltd as our Distinguished Speaker at,0.7717
14,2022-07-16 09:23:51+00:00,Were not gonna air condition and build a better combustion engine and find more accessible oil in the Arctic and m,0.4404
15,2022-07-16 08:21:45+00:00,Reliance Industries RILbacked firm Embibe gets  stake in Funtoot embibe Edtech,0.0
16,2022-07-16 08:11:37+00:00,RT This has been the case across many industries The SOLE reliance on the HYPER visibility of the Other in senior positions is,0.0
17,2022-07-16 07:57:45+00:00,RT This has been the case across many industries The SOLE reliance on the HYPER visibility of the Other in senior positions is,0.0
18,2022-07-16 07:25:48+00:00,RT This has been the case across many industries The SOLE reliance on the HYPER visibility of the Other in senior positions is,0.0
19,2022-07-16 07:25:43+00:00,Edtech startup Embibe raises Rs  Cr  million from Reliance Industries embibe edtech,0.0
20,2022-07-16 07:19:34+00:00,RT This has been the case across many industries The SOLE reliance on the HYPER visibility of the Other in senior positions is,0.0
21,2022-07-16 07:09:22+00:00,RT This has been the case across many industries The SOLE reliance on the HYPER visibility of the Other in senior positions is,0.0
22,2022-07-16 07:09:03+00:00,RT RIL partners with We are very thankful to Mrs Nita Ambani and Reliance Industries with whom AFI,0.6115
23,2022-07-16 07:08:52+00:00,This has been the case across many industries The SOLE reliance on the HYPER visibility of the Other in senior pos,0.0
24,2022-07-16 06:37:05+00:00,RT Reliance industries Ltd,0.0
25,2022-07-16 05:59:52+00:00,Nita Mukesh Ambani is an Indian Philanthropist She is the chairperson and founder of the Reliance Foundation Dhir,0.0
26,2022-07-16 05:38:47+00:00,Funding alert Edtech startup Embibe raises Rs  Cr from Reliance Industries  YourStory  DailyHunt,0.296
27,2022-07-16 05:11:12+00:00,Smt Nita M Ambani statement on reliance partnership with the athletic for the expand of sports industries in India,0.3182
28,2022-07-16 04:58:15+00:00,Reliance Industries Partners With AFI to Support Holistic Development of Indian Athletes and Grow Indias Olympic M,0.4019
29,2022-07-16 04:34:33+00:00,RT RIL partners with We are very thankful to Mrs Nita Ambani and Reliance Industries with whom AFI,0.6115
30,2022-07-16 04:30:04+00:00,Sr Engineer MPC Electrical  Reliance Industries Ltd  years,0.0
31,2022-07-16 04:23:39+00:00,Funding alert Reliance Industries invests Rs  Cr in edtech startup Embibe embibe OnlineLearning,0.296
32,2022-07-16 03:59:37+00:00,Reliance Industries to buy  stake in Embibe  The Hindu BusinessLine embibe Edtech,0.0
33,2022-07-16 03:13:03+00:00,The market always overreacts on bad news I expect that reliance will surprise everyone with a strong result,-0.3182
34,2022-07-16 00:02:56+00:00,RT Equity Cash Call Buy Reliance Industries at  sl  tgt  reliance reliancejio intraday intradaytrading ,0.0
35,2022-07-15 21:23:58+00:00,relianceindustries bn market cap largest company in India santanderchile largest bank in Chile,0.0
36,2022-07-15 21:22:01+00:00,relianceindustries largest company in India gt bn mkt cap corpbanca top  Chilean bank santander,0.4404
37,2022-07-15 21:03:35+00:00,I think what really needs to happen is to get away from the reliance of oil Clean energy sources are a,0.5859
38,2022-07-15 19:43:16+00:00,RT This partnership is also an important step towards our dream of strengthening the Olympic Movement in India says IOC,0.7184
39,2022-07-15 18:36:03+00:00,RT RIL partners with We are very thankful to Mrs Nita Ambani and Reliance Industries with whom AFI,0.6115
40,2022-07-15 18:30:04+00:00,Executive Materials mgt A MFG JMD Money  P and C Store DTA Ind Reliance Industries Ltd  years,0.0
41,2022-07-15 18:28:02+00:00,RT RELIANCE INDUSTRIES TO REPORT RESULTS JULY  Finally  Reliance,0.0
42,2022-07-15 18:26:17+00:00,RT Jio Airtel Vodafone Idea and new entrant Adani Data Networks have all entered the auction for the G Spectrum Here a,0.0
43,2022-07-15 18:10:38+00:00,investing invest StocksToWatch StocksInFocus stocks StockMarketindia nifty sensex nseindia BSEB ,0.4019
44,2022-07-15 18:06:52+00:00,RT RIL partners with We are very thankful to Mrs Nita Ambani and Reliance Industries with whom AFI,0.6115
45,2022-07-15 18:05:34+00:00,RT RIL partners with We are very thankful to Mrs Nita Ambani and Reliance Industries with whom AFI,0.6115
46,2022-07-15 17:27:36+00:00,,0.0
47,2022-07-15 17:04:53+00:00,Well a not my use but the authors use and b per capita is perfectly legitimate here in terms of co,0.81
48,2022-07-15 16:44:00+00:00,So true that natural wealth will also be sold to a few friends Will,0.9033
49,2022-07-15 16:03:28+00:00,FII Index Future Long  FII Index Future Short  FII Net Cash   DII Net Cash   Reliance Ind,0.0
50,2022-07-15 14:16:40+00:00,RT RIL partners with We are very thankful to Mrs Nita Ambani and Reliance Industries with whom AFI,0.6115
51,2022-07-15 14:13:33+00:00,RT Megaconglomerates Reliance Industries Limited and Aditya Birla Group have invested in more than a dozen Indian designer brands T,-0.2263
52,2022-07-15 14:06:43+00:00,BuyerR and M   Reliance Industries Ltd  years,0.0
53,2022-07-15 14:05:58+00:00,Megaconglomerates Reliance Industries Limited and Aditya Birla Group have invested in more than a dozen Indian des,-0.2263
54,2022-07-15 14:03:14+00:00,Watering young trees etc is also an investment in the environment and our futures together And if youre strugg,0.0
55,2022-07-15 14:02:44+00:00,RT Megaconglomerates Reliance Industries Limited and Aditya Birla Group have invested in more than a dozen Indian designer brands T,-0.2263
56,2022-07-15 13:38:24+00:00,NEXTWEEK NIFTY HOPE for UPSWING RELIANCE INDUSTRIES has informed BSE that the meeting of the Boar,0.7944
57,2022-07-15 13:16:02+00:00,got an Idea I will purchase a share of Reliance Industries Limited and send one mail,0.0772
58,2022-07-15 13:12:23+00:00,RT Reliance Industries Limited holds  stake in Hathway Broadband Funny thing is I have opted for Reliance,0.25
59,2022-07-15 13:12:05+00:00,Reliance Industries Limited holds  stake in Hathway Broadband Funny thing is I have opted for R,0.25
60,2022-07-15 13:02:40+00:00,RELIANCE INDUSTRIES BOARD MEETING ON JULY  TO CONSIDER Q RESULTS,0.0
61,2022-07-15 12:40:04+00:00,RELIANCE INDUSTRIES LTD    Board Meeting Intimation for Board Meeting,0.0
62,2022-07-15 12:39:24+00:00,RELIANCE INDUSTRIES TO REPORT RESULTS JULY  Finally  Reliance,0.0
63,2022-07-15 11:50:16+00:00,You lost the race Hathway people were faster than you Anyways it is owned by Reliance i,-0.3182
64,2022-07-15 11:37:09+00:00,RT This partnership is also an important step towards our dream of strengthening the Olympic Movement in India says IOC,0.7184
65,2022-07-15 11:24:23+00:00,RELIANCE INDUSTRIES PARTNERS WITH THE ATHLETICS FEDERATION OF INDIA,0.0
66,2022-07-15 11:16:50+00:00,Reliance Industries partners with the athletics federation of India to support Grow Indias Olympic Movement,0.4019
67,2022-07-15 11:05:29+00:00,RT RELIANCE INDUSTRIES PARTNERS WITH THE ATHLETICS FEDERATION OF INDIA TO SUPPORT THE HOLISTIC DEVELOPMENT OF INDIAN ATHLETES A,0.4019
68,2022-07-15 11:04:59+00:00,RT This partnership is also an important step towards our dream of strengthening the Olympic Movement in India says IOC,0.7184
69,2022-07-15 10:52:02+00:00,RT Share Price of Adani Enterprises ADANIENT and Reliance Industries RELIANCE  years ago Adani   Reliance  ,0.296
70,2022-07-15 10:08:44+00:00,RT BoF Megaconglomerates Reliance Industries Limited and Aditya Birla Group have invested in more than a dozen In,-0.2263
71,2022-07-15 10:00:08+00:00,Megaconglomerates Reliance Industries Limited and Aditya Birla Group have invested in more than a dozen Indian des,-0.2263
72,2022-07-15 09:59:11+00:00,RT This partnership is also an important step towards our dream of strengthening the Olympic Movement in India says IOC,0.7184
73,2022-07-15 09:49:00+00:00,Reliance Industries team up with Athletics Federation of India RelianceIndustries AthleticsFederationofIndia,0.0
74,2022-07-15 09:24:31+00:00,RT This partnership is also an important step towards our dream of strengthening the Olympic Movement in India says IOC,0.7184
75,2022-07-15 09:21:41+00:00,RT RIL partners with We are very thankful to Mrs Nita Ambani and Reliance Industries with whom AFI,0.6115
76,2022-07-15 09:11:24+00:00,RT RIL partners with We are very thankful to Mrs Nita Ambani and Reliance Industries with whom AFI,0.6115
77,2022-07-15 09:09:39+00:00,RT RIL partners with We are very thankful to Mrs Nita Ambani and Reliance Industries with whom AFI,0.6115
78,2022-07-15 09:04:51+00:00,Reliance Industries share price underperforms Nifty in July analysts SAYS concerns overdone RelianceIndustries,0.5994
79,2022-07-15 09:02:56+00:00,Buy Reliance Industries target price Rs  ICICI Direct,0.0
80,2022-07-15 08:26:14+00:00,RT RIL partners with We are very thankful to Mrs Nita Ambani and Reliance Industries with whom AFI,0.6115
81,2022-07-15 08:25:14+00:00,Reliance Industries share price underperforms Nifty in July analysts say concerns overdone should you buy,0.5994
82,2022-07-15 08:15:44+00:00,RT Reliance Industries share price underperforms Nifty in July analysts say concerns overdone should you buy RelianceIndust,0.5994
83,2022-07-15 08:15:30+00:00,Reliance Industries share price underperforms Nifty in July analysts say concerns overdone should you buy,0.5994
84,2022-07-15 08:00:12+00:00,RT This partnership is also an important step towards our dream of strengthening the Olympic Movement in India says IOC,0.7184
85,2022-07-15 07:33:41+00:00,RT This partnership is also an important step towards our dream of strengthening the Olympic Movement in India says IOC,0.7184
86,2022-07-15 07:32:17+00:00,RT Share Price of Adani Enterprises ADANIENT and Reliance Industries RELIANCE  years ago Adani   Reliance  ,0.296
87,2022-07-15 07:32:14+00:00,RT This partnership is also an important step towards our dream of strengthening the Olympic Movement in India says IOC,0.7184
88,2022-07-15 07:13:08+00:00,RT Sales  JioMart was softlaunched in December  and it deals in grocery and daily needs from nearby vendors Relianc,0.0
89,2022-07-15 07:12:17+00:00,Buy Reliance Industries target price Rs  ICICI Direct ETMarkets DailyRecos StockPicks DailyPicks,0.0
90,2022-07-15 07:08:56+00:00,Reliance Industries Partners With The Athletics Federation Of India RelianceIndustries AthleticsFedrationOfIndia,0.0
91,2022-07-15 07:08:07+00:00,RT Share Price of Adani Enterprises ADANIENT and Reliance Industries RELIANCE  years ago Adani   Reliance  ,0.296
92,2022-07-15 06:44:59+00:00,Reliance Foundation has been a dedicated partner to AFI over the years and this tieup is set to deepen the engagem,0.4588
93,2022-07-15 06:40:43+00:00,Share Price of Adani Enterprises ADANIENT and Reliance Industries RELIANCE  years ago Adani   Reliance,0.296
94,2022-07-15 06:35:38+00:00,RT RIL partners with We are very thankful to Mrs Nita Ambani and Reliance Industries with whom AFI,0.6115
95,2022-07-15 06:34:04+00:00,Buy Reliance Industries target price Rs  ICICI Direct Reliance Industries Ltd incorporated in the year ,0.0
96,2022-07-15 06:33:39+00:00,Buy Reliance Industries target price Rs  ICICI Direct Reliance Industries Ltd incorporated in the year ,0.0
97,2022-07-15 06:32:00+00:00,RT RIL partners with We are very thankful to Mrs Nita Ambani and Reliance Industries with whom AFI,0.6115
98,2022-07-15 06:28:27+00:00,RT RIL partners with We are very thankful to Mrs Nita Ambani and Reliance Industries with whom AFI,0.6115
99,2022-07-15 06:28:23+00:00,RT RIL partners with We are very thankful to Mrs Nita Ambani and Reliance Industries with whom AFI,0.6115
